=========================================
1959 AX-1 INPUT ECHO
=========================================

CONTROL PARAMETERS:
  Eigenmode:         alpha
  Initial Δt:         2.00000E+00 μsec
  Maximum Δt:         2.00000E+00 μsec
  End time:           3.00000E+02 μsec
  CSC (Courant):        3.000
  CVP (Viscosity):      2.000
  W limit:              0.300
  Hydro/Neutron:         1

GEOMETRY:
  Number of zones:      39
  Radii (cm):
    1  9.500000E-01
    2  1.900000E+00
    3  2.850000E+00
    4  3.800000E+00
    5  4.750000E+00
    6  5.700000E+00
    7  6.650000E+00
    8  7.600000E+00
    9  8.550000E+00
   10  9.500000E+00
   11  1.045000E+01
   12  1.140000E+01
   13  1.235000E+01
   14  1.330000E+01
   15  1.425000E+01
   16  1.520000E+01
   17  1.615000E+01
   18  1.710000E+01
   19  1.805000E+01
   20  1.900000E+01
   21  1.995000E+01
   22  2.090000E+01
   23  2.185000E+01
   24  2.280000E+01
   25  2.375000E+01
   26  2.470000E+01
   27  2.565000E+01
   28  2.660000E+01
   29  2.755000E+01
   30  2.850000E+01
   31  3.030000E+01
   32  3.210000E+01
   33  3.390000E+01
   34  3.570000E+01
   35  3.750000E+01
   36  3.930000E+01
   37  4.110000E+01
   38  4.290000E+01
   39  4.470000E+01
   40  0.000000E+00

INITIAL CONDITIONS:
  Zone  Mat    Density      Temp
              (g/cc)       (keV)
    2    1  7.920000E+00  1.000000E-04
    3    1  7.920000E+00  1.000000E-04
    4    1  7.920000E+00  1.000000E-04
    5    1  7.920000E+00  1.000000E-04
    6    1  7.920000E+00  1.000000E-04
    7    1  7.920000E+00  1.000000E-04
    8    1  7.920000E+00  1.000000E-04
    9    1  7.920000E+00  1.000000E-04
   10    1  7.920000E+00  1.000000E-04
   11    1  7.920000E+00  1.000000E-04
   12    1  7.920000E+00  1.000000E-04
   13    1  7.920000E+00  1.000000E-04
   14    1  7.920000E+00  1.000000E-04
   15    1  7.920000E+00  1.000000E-04
   16    1  7.920000E+00  1.000000E-04
   17    1  7.920000E+00  1.000000E-04
   18    1  7.920000E+00  1.000000E-04
   19    1  7.920000E+00  1.000000E-04
   20    1  7.920000E+00  1.000000E-04
   21    1  7.920000E+00  1.000000E-04
   22    1  7.920000E+00  1.000000E-04
   23    1  7.920000E+00  1.000000E-04
   24    1  7.920000E+00  1.000000E-04
   25    1  7.920000E+00  1.000000E-04
   26    2  1.583000E+01  5.000000E-05
   27    2  1.583000E+01  5.000000E-05
   28    2  1.583000E+01  5.000000E-05
   29    2  1.583000E+01  5.000000E-05
   30    2  1.583000E+01  5.000000E-05
   31    2  1.583000E+01  5.000000E-05
   32    2  1.583000E+01  5.000000E-05
   33    2  1.583000E+01  5.000000E-05
   34    2  1.583000E+01  5.000000E-05
   35    2  1.583000E+01  5.000000E-05
   36    2  1.583000E+01  5.000000E-05
   37    2  1.583000E+01  5.000000E-05
   38    2  1.583000E+01  5.000000E-05
   39    2  1.583000E+01  5.000000E-05

MATERIALS:   2 materials
Material   1
  Groups:   1
  EOS: P = ALPHA*rho + BETA*theta + TAU
    ALPHA =  2.87300E-02
    BETA  =  2.78460E+02
    TAU   = -3.94600E-01
  Specific heat: Cv = ACV + BCV*theta
    ACV   =  1.21630E+01
    BCV   =  5.78000E+03

Material   2
  Groups:   1
  EOS: P = ALPHA*rho + BETA*theta + TAU
    ALPHA =  2.87300E-02
    BETA  =  2.78460E+02
    TAU   = -4.68719E-01
  Specific heat: Cv = ACV + BCV*theta
    ACV   =  1.21630E+01
    BCV   =  5.78000E+03

=========================================

=========================================
1959 AX-1 TRANSIENT RESULTS
=========================================

  TIME      QP        POWER     ALPHA      K-EFF      DELT       W     R_MAX
 (μsec)  (10¹² erg) (arb)    (μsec⁻¹)              (μsec)             (cm)
-----------------------------------------------------------------------------------------
 2.000000  3.6532E+03  1.0267E+00    0.013186  1.003270  1.0000E+00  1.0639   43.8465
12.000000  3.6636E+03  1.1792E+00    0.013186  1.003270  1.0000E+00  0.0044   43.8465
22.000000  3.6763E+03  1.3454E+00    0.013186  1.003270  1.0000E+00  0.0046   43.8465
32.000000  3.6908E+03  1.5350E+00    0.013186  1.003270  1.0000E+00  0.0048   43.8465
42.000000  3.7073E+03  1.7514E+00    0.013186  1.003270  1.0000E+00  0.0050   43.8465
52.000000  3.7262E+03  1.9982E+00    0.013186  1.003270  1.0000E+00  0.0052   43.8465
62.000000  3.7477E+03  2.2798E+00    0.013186  1.003270  1.0000E+00  0.0054   43.8465
72.000000  3.7722E+03  2.5841E+00    0.013186  1.003270  2.0000E+00  0.0230   43.8465
82.000000  3.8002E+03  2.9483E+00    0.013186  1.003270  2.0000E+00  0.0243   43.8465
92.000000  3.8321E+03  3.3638E+00    0.013186  1.003270  2.0000E+00  0.0258   43.8465
*********  3.8686E+03  3.8379E+00    0.013186  1.003270  2.0000E+00  0.0275   43.8465
*********  3.9101E+03  4.3788E+00    0.013186  1.003270  2.0000E+00  0.0295   43.8465
*********  3.9576E+03  4.9960E+00    0.013186  1.003270  2.0000E+00  0.0318   43.8465
*********  4.0117E+03  5.7002E+00    0.013186  1.003270  2.0000E+00  0.0343   43.8465
*********  4.0734E+03  6.5036E+00    0.013186  1.003270  2.0000E+00  0.0373   43.8465
*********  4.1438E+03  7.4202E+00    0.013186  1.003270  2.0000E+00  0.0406   43.8465
*********  4.2242E+03  8.4660E+00    0.013186  1.003270  2.0000E+00  0.0445   43.8465
*********  4.3158E+03  9.6593E+00    0.013186  1.003270  2.0000E+00  0.0488   43.8465
*********  4.4204E+03  1.1021E+01    0.013186  1.003270  2.0000E+00  0.0538   43.8465
*********  4.5397E+03  1.2574E+01    0.013186  1.003270  2.0000E+00  0.0595   43.8465
*********  4.6759E+03  1.4346E+01    0.013186  1.003270  2.0000E+00  0.0659   43.8465
*********  4.8312E+03  1.6368E+01    0.013186  1.003270  2.0000E+00  0.0733   43.8465
*********  5.0084E+03  1.8675E+01    0.013186  1.003270  2.0000E+00  0.0817   43.8465
*********  5.2105E+03  2.1307E+01    0.013186  1.003270  2.0000E+00  0.0913   43.8465
*********  5.4412E+03  2.4311E+01    0.013186  1.003270  2.0000E+00  0.1023   43.8465
*********  5.7043E+03  2.7737E+01    0.013186  1.003270  2.0000E+00  0.1148   43.8465
*********  6.0041E+03  3.1546E+01    0.012700  1.003270  2.0000E+00  0.1339   43.8493
*********  6.3437E+03  3.5625E+01    0.011683  1.003270  2.0000E+00  0.1458   43.8533
*********  6.7235E+03  3.9441E+01    0.008286  1.003270  2.0000E+00  0.1883   43.8573
*********  7.1311E+03  4.1334E+01    0.002286  1.003270  2.0000E+00  0.2335   43.8613
*********  7.4615E+03  4.1098E+01   -0.002514  1.003270  2.0000E+00  0.2962   43.8645

=========================================
SIMULATION SUMMARY
=========================================
Final time:                300.000000 μsec
Hydro cycles:                  8675
Total S4 iterations:            372
Final alpha:              -2.513695E-03
Final k-eff:                 1.003270
Final energy:              7.461541E+03 × 10¹² ergs
Final KE:                  5.332221E+00 × 10¹² ergs
Final IE:                  1.726934E+03 × 10¹² ergs
Energy balance CHECK:      2.753337E-02
Final radius:                 43.8645 cm
Final max temp:                0.0010 keV
Final max pressure:        6.894510E-02 megabars
=========================================
