=========================================
1959 AX-1 INPUT ECHO
=========================================

CONTROL PARAMETERS:
  Eigenmode:         alpha
  Initial Δt:         2.00000E+00 μsec
  Maximum Δt:         2.00000E+00 μsec
  End time:           3.00000E+02 μsec
  CSC (Courant):        3.000
  CVP (Viscosity):      2.000
  W limit:              0.300
  Hydro/Neutron:         1

GEOMETRY:
  Number of zones:      39
  Radii (cm):
    1  9.500000E-01
    2  1.900000E+00
    3  2.850000E+00
    4  3.800000E+00
    5  4.750000E+00
    6  5.700000E+00
    7  6.650000E+00
    8  7.600000E+00
    9  8.550000E+00
   10  9.500000E+00
   11  1.045000E+01
   12  1.140000E+01
   13  1.235000E+01
   14  1.330000E+01
   15  1.425000E+01
   16  1.520000E+01
   17  1.615000E+01
   18  1.710000E+01
   19  1.805000E+01
   20  1.900000E+01
   21  1.995000E+01
   22  2.090000E+01
   23  2.185000E+01
   24  2.280000E+01
   25  2.375000E+01
   26  2.470000E+01
   27  2.565000E+01
   28  2.660000E+01
   29  2.755000E+01
   30  2.850000E+01
   31  3.030000E+01
   32  3.210000E+01
   33  3.390000E+01
   34  3.570000E+01
   35  3.750000E+01
   36  3.930000E+01
   37  4.110000E+01
   38  4.290000E+01
   39  4.470000E+01
   40  0.000000E+00

INITIAL CONDITIONS:
  Zone  Mat    Density      Temp
              (g/cc)       (keV)
    2    1  7.920000E+00  1.000000E-04
    3    1  7.920000E+00  1.000000E-04
    4    1  7.920000E+00  1.000000E-04
    5    1  7.920000E+00  1.000000E-04
    6    1  7.920000E+00  1.000000E-04
    7    1  7.920000E+00  1.000000E-04
    8    1  7.920000E+00  1.000000E-04
    9    1  7.920000E+00  1.000000E-04
   10    1  7.920000E+00  1.000000E-04
   11    1  7.920000E+00  1.000000E-04
   12    1  7.920000E+00  1.000000E-04
   13    1  7.920000E+00  1.000000E-04
   14    1  7.920000E+00  1.000000E-04
   15    1  7.920000E+00  1.000000E-04
   16    1  7.920000E+00  1.000000E-04
   17    1  7.920000E+00  1.000000E-04
   18    1  7.920000E+00  1.000000E-04
   19    1  7.920000E+00  1.000000E-04
   20    1  7.920000E+00  1.000000E-04
   21    1  7.920000E+00  1.000000E-04
   22    1  7.920000E+00  1.000000E-04
   23    1  7.920000E+00  1.000000E-04
   24    1  7.920000E+00  1.000000E-04
   25    1  7.920000E+00  1.000000E-04
   26    2  1.583000E+01  5.000000E-05
   27    2  1.583000E+01  5.000000E-05
   28    2  1.583000E+01  5.000000E-05
   29    2  1.583000E+01  5.000000E-05
   30    2  1.583000E+01  5.000000E-05
   31    2  1.583000E+01  5.000000E-05
   32    2  1.583000E+01  5.000000E-05
   33    2  1.583000E+01  5.000000E-05
   34    2  1.583000E+01  5.000000E-05
   35    2  1.583000E+01  5.000000E-05
   36    2  1.583000E+01  5.000000E-05
   37    2  1.583000E+01  5.000000E-05
   38    2  1.583000E+01  5.000000E-05
   39    2  1.583000E+01  5.000000E-05

MATERIALS:   2 materials
Material   1
  Groups:   1
  EOS: P = ALPHA*rho + BETA*theta + TAU
    ALPHA =  2.87300E-02
    BETA  =  2.78460E+02
    TAU   = -3.94600E-01
  Specific heat: Cv = ACV + BCV*theta
    ACV   =  1.21630E+01
    BCV   =  5.78000E+03

Material   2
  Groups:   1
  EOS: P = ALPHA*rho + BETA*theta + TAU
    ALPHA =  2.87300E-02
    BETA  =  2.78460E+02
    TAU   = -4.68719E-01
  Specific heat: Cv = ACV + BCV*theta
    ACV   =  1.21630E+01
    BCV   =  5.78000E+03

=========================================

=========================================
1959 AX-1 TRANSIENT RESULTS
=========================================

  TIME      QP        POWER     ALPHA      K-EFF      DELT       W     R_MAX
 (μsec)  (10¹² erg) (arb)    (μsec⁻¹)              (μsec)             (cm)
-----------------------------------------------------------------------------------------
 2.000000  3.6532E+03  1.0267E+00    0.013186  1.003270  1.0000E+00  1.0639   43.8465
13.000000  3.6648E+03  1.1870E+00    0.013186  1.003270  2.0000E+00  0.0179   43.8465
23.000000  3.6777E+03  1.3543E+00    0.013186  1.003270  2.0000E+00  0.0185   43.8465
33.000000  3.6923E+03  1.5452E+00    0.013186  1.003270  2.0000E+00  0.0192   43.8465
43.000000  3.7091E+03  1.7629E+00    0.013186  1.003270  2.0000E+00  0.0200   43.8465
53.000000  3.7282E+03  2.0114E+00    0.013186  1.003270  2.0000E+00  0.0209   43.8465
63.000000  3.7500E+03  2.2949E+00    0.013186  1.003270  2.0000E+00  0.0219   43.8465
73.000000  3.7749E+03  2.6184E+00    0.013186  1.003270  2.0000E+00  0.0231   43.8465
83.000000  3.8032E+03  2.9874E+00    0.013186  1.003270  2.0000E+00  0.0244   43.8465
93.000000  3.8356E+03  3.4085E+00    0.013186  1.003270  2.0000E+00  0.0260   43.8465
*********  3.8725E+03  3.8889E+00    0.013186  1.003270  2.0000E+00  0.0277   43.8465
*********  3.9147E+03  4.4370E+00    0.013186  1.003270  2.0000E+00  0.0297   43.8465
*********  3.9627E+03  5.0623E+00    0.013186  1.003270  2.0000E+00  0.0320   43.8465
*********  4.0176E+03  5.7758E+00    0.013186  1.003270  2.0000E+00  0.0346   43.8465
*********  4.0801E+03  6.5899E+00    0.013186  1.003270  2.0000E+00  0.0376   43.8465
*********  4.1515E+03  7.5187E+00    0.013186  1.003270  2.0000E+00  0.0410   43.8465
*********  4.2330E+03  8.5784E+00    0.013186  1.003270  2.0000E+00  0.0449   43.8465
*********  4.3259E+03  9.7875E+00    0.013186  1.003270  2.0000E+00  0.0493   43.8465
*********  4.4319E+03  1.1167E+01    0.013186  1.003270  2.0000E+00  0.0544   43.8465
*********  4.5528E+03  1.2741E+01    0.013186  1.003270  2.0000E+00  0.0601   43.8465
*********  4.6908E+03  1.4537E+01    0.013186  1.003270  2.0000E+00  0.0667   43.8465
*********  4.8482E+03  1.6585E+01    0.013186  1.003270  2.0000E+00  0.0742   43.8465
*********  5.0278E+03  1.8923E+01    0.013186  1.003270  2.0000E+00  0.0827   43.8465
*********  5.2327E+03  2.1590E+01    0.013186  1.003270  2.0000E+00  0.0925   43.8465
*********  5.4665E+03  2.4633E+01    0.013186  1.003270  2.0000E+00  0.1036   43.8465
*********  5.7332E+03  2.8105E+01    0.013186  1.003270  2.0000E+00  0.1163   43.8465
*********  6.0370E+03  3.1958E+01    0.012577  1.003270  2.0000E+00  0.1307   43.8465
*********  6.3805E+03  3.5974E+01    0.011241  1.003270  2.0000E+00  0.1407   43.8465
*********  6.7621E+03  3.9404E+01    0.006870  1.003270  2.0000E+00  0.1531   43.8465
*********  7.1652E+03  4.0714E+01    0.000870  1.003270  2.0000E+00  0.1389   43.8465
*********  7.4855E+03  4.0026E+01   -0.003930  1.003270  2.0000E+00  0.1391   43.8820

=========================================
SIMULATION SUMMARY
=========================================
Final time:                301.000000 μsec
Hydro cycles:                   427
Total S4 iterations:            372
Final alpha:              -3.929790E-03
Final k-eff:                 1.003270
Final energy:              7.485485E+03 × 10¹² ergs
Final KE:                  8.093446E+01 × 10¹² ergs
Final IE:                  1.730198E+03 × 10¹² ergs
Energy balance CHECK:     -1.348853E-02
Final radius:                 43.8820 cm
Final max temp:                0.0008 keV
Final max pressure:        1.707928E-02 megabars
=========================================
