=========================================
1959 AX-1 INPUT ECHO
=========================================

CONTROL PARAMETERS:
  Eigenmode:         alpha
  Initial Δt:         2.00000E+00 μsec
  Maximum Δt:         2.00000E+00 μsec
  End time:           3.20000E+02 μsec
  CSC (Courant):        3.000
  CVP (Viscosity):      2.000
  W limit:              0.300
  Hydro/Neutron:         1

GEOMETRY:
  Number of zones:      39
  Radii (cm):
    1  9.500000E-01
    2  1.900000E+00
    3  2.850000E+00
    4  3.800000E+00
    5  4.750000E+00
    6  5.700000E+00
    7  6.650000E+00
    8  7.600000E+00
    9  8.550000E+00
   10  9.500000E+00
   11  1.045000E+01
   12  1.140000E+01
   13  1.235000E+01
   14  1.330000E+01
   15  1.425000E+01
   16  1.520000E+01
   17  1.615000E+01
   18  1.710000E+01
   19  1.805000E+01
   20  1.900000E+01
   21  1.995000E+01
   22  2.090000E+01
   23  2.185000E+01
   24  2.280000E+01
   25  2.375000E+01
   26  2.470000E+01
   27  2.565000E+01
   28  2.660000E+01
   29  2.755000E+01
   30  2.850000E+01
   31  3.030000E+01
   32  3.210000E+01
   33  3.390000E+01
   34  3.570000E+01
   35  3.750000E+01
   36  3.930000E+01
   37  4.110000E+01
   38  4.290000E+01
   39  4.470000E+01
   40  0.000000E+00

INITIAL CONDITIONS:
  Zone  Mat    Density      Temp
              (g/cc)       (keV)
    2    1  7.920000E+00  1.000000E-04
    3    1  7.920000E+00  1.000000E-04
    4    1  7.920000E+00  1.000000E-04
    5    1  7.920000E+00  1.000000E-04
    6    1  7.920000E+00  1.000000E-04
    7    1  7.920000E+00  1.000000E-04
    8    1  7.920000E+00  1.000000E-04
    9    1  7.920000E+00  1.000000E-04
   10    1  7.920000E+00  1.000000E-04
   11    1  7.920000E+00  1.000000E-04
   12    1  7.920000E+00  1.000000E-04
   13    1  7.920000E+00  1.000000E-04
   14    1  7.920000E+00  1.000000E-04
   15    1  7.920000E+00  1.000000E-04
   16    1  7.920000E+00  1.000000E-04
   17    1  7.920000E+00  1.000000E-04
   18    1  7.920000E+00  1.000000E-04
   19    1  7.920000E+00  1.000000E-04
   20    1  7.920000E+00  1.000000E-04
   21    1  7.920000E+00  1.000000E-04
   22    1  7.920000E+00  1.000000E-04
   23    1  7.920000E+00  1.000000E-04
   24    1  7.920000E+00  1.000000E-04
   25    1  7.920000E+00  1.000000E-04
   26    2  1.583000E+01  5.000000E-05
   27    2  1.583000E+01  5.000000E-05
   28    2  1.583000E+01  5.000000E-05
   29    2  1.583000E+01  5.000000E-05
   30    2  1.583000E+01  5.000000E-05
   31    2  1.583000E+01  5.000000E-05
   32    2  1.583000E+01  5.000000E-05
   33    2  1.583000E+01  5.000000E-05
   34    2  1.583000E+01  5.000000E-05
   35    2  1.583000E+01  5.000000E-05
   36    2  1.583000E+01  5.000000E-05
   37    2  1.583000E+01  5.000000E-05
   38    2  1.583000E+01  5.000000E-05
   39    2  1.583000E+01  5.000000E-05

MATERIALS:   2 materials
Material   1
  Groups:   1
  EOS: P = ALPHA*rho + BETA*theta + TAU
    ALPHA =  2.87300E-02
    BETA  =  2.78460E+02
    TAU   = -3.94600E-01
  Specific heat: Cv = ACV + BCV*theta
    ACV   =  1.21630E+01
    BCV   =  5.78000E+03

Material   2
  Groups:   1
  EOS: P = ALPHA*rho + BETA*theta + TAU
    ALPHA =  2.87300E-02
    BETA  =  2.78460E+02
    TAU   = -4.68719E-01
  Specific heat: Cv = ACV + BCV*theta
    ACV   =  1.21630E+01
    BCV   =  5.78000E+03

=========================================

=========================================
1959 AX-1 TRANSIENT RESULTS
=========================================

  TIME      QP        POWER     ALPHA      K-EFF      DELT       W     R_MAX
 (μsec)  (10¹² erg) (arb)    (μsec⁻¹)              (μsec)             (cm)
-----------------------------------------------------------------------------------------
 2.000000  3.6532E+03  1.0000E+00    0.013186  1.003270  1.0000E+00  1.0639   43.8465
13.000000  3.6644E+03  1.1561E+00    0.013186  1.003270  2.0000E+00  0.0178   43.8465
23.000000  3.6770E+03  1.3190E+00    0.013186  1.003270  2.0000E+00  0.0184   43.8465
33.000000  3.6913E+03  1.5050E+00    0.013186  1.003270  2.0000E+00  0.0191   43.8465
43.000000  3.7076E+03  1.7171E+00    0.013186  1.003270  2.0000E+00  0.0199   43.8465
53.000000  3.7262E+03  1.9591E+00    0.013186  1.003270  2.0000E+00  0.0208   43.8465
63.000000  3.7474E+03  2.2352E+00    0.013186  1.003270  2.0000E+00  0.0218   43.8465
73.000000  3.7716E+03  2.5502E+00    0.013186  1.003270  2.0000E+00  0.0229   43.8465
83.000000  3.7993E+03  2.9097E+00    0.013186  1.003270  2.0000E+00  0.0242   43.8465
93.000000  3.8308E+03  3.3198E+00    0.013186  1.003270  2.0000E+00  0.0257   43.8465
*********  3.8668E+03  3.7877E+00    0.013186  1.003270  2.0000E+00  0.0275   43.8465
*********  3.9078E+03  4.3215E+00    0.013186  1.003270  2.0000E+00  0.0294   43.8465
*********  3.9546E+03  4.9306E+00    0.013186  1.003270  2.0000E+00  0.0316   43.8465
*********  4.0080E+03  5.6256E+00    0.013186  1.003270  2.0000E+00  0.0342   43.8465
*********  4.0690E+03  6.4185E+00    0.013186  1.003270  2.0000E+00  0.0371   43.8465
*********  4.1385E+03  7.3231E+00    0.013186  1.003270  2.0000E+00  0.0404   43.8465
*********  4.2178E+03  8.3553E+00    0.013186  1.003270  2.0000E+00  0.0441   43.8465
*********  4.3083E+03  9.5329E+00    0.013186  1.003270  2.0000E+00  0.0485   43.8465
*********  4.4116E+03  1.0876E+01    0.013186  1.003270  2.0000E+00  0.0534   43.8465
*********  4.5294E+03  1.2409E+01    0.013186  1.003270  2.0000E+00  0.0590   43.8465
*********  4.6637E+03  1.4158E+01    0.013186  1.003270  2.0000E+00  0.0654   43.8465
*********  4.8171E+03  1.6154E+01    0.013186  1.003270  2.0000E+00  0.0726   43.8465
*********  4.9920E+03  1.8431E+01    0.013186  1.003270  2.0000E+00  0.0810   43.8465
*********  5.1916E+03  2.1029E+01    0.013186  1.003270  2.0000E+00  0.0904   43.8465
*********  5.4192E+03  2.3992E+01    0.013186  1.003270  2.0000E+00  0.1013   43.8465
*********  5.6790E+03  2.7374E+01    0.013186  1.003270  2.0000E+00  0.1136   43.8465
*********  5.9750E+03  3.1111E+01    0.012037  1.003270  1.0000E+00  0.6144   43.8465
*********  6.2628E+03  3.4843E+01    0.007271  1.003270  1.0000E-03********   43.8465
*********  3.2797E+11  3.5792E+01    0.007247  1.003270  1.0000E-03********  200.0853

=========================================
SIMULATION SUMMARY
=========================================
Final time:                276.704234 μsec
Hydro cycles:                786228
Total S4 iterations:            382
Final alpha:               7.247476E-03
Final k-eff:                 1.003270
Final energy:              3.279739E+11 × 10¹² ergs
Final KE:                  1.997138E+10 × 10¹² ergs
Final IE:                  7.730122E+10 × 10¹² ergs
Energy balance CHECK:     -2.423382E-01
Final radius:                200.0853 cm
Final max temp:               97.8744 keV
Final max pressure:        5.598372E+04 megabars
=========================================
